{
  "description": "The definition of zero or more test cases.",
  "$id": "https://mfulton26.github.io/adventofcode/testCases.schema.json",
  "$schema": "http://json-schema.org/schema#",
  "type": "array",
  "items": {
    "description": "The definition of a single test case.",
    "type": "object",
    "properties": {
      "name": {
        "description": "The name of the test case to be used in reporting, etc.",
        "type": "string"
      },
      "functionName": {
        "description": "The name of the target function to invoke in testing. Defaults to `solve`.",
        "type": "string",
        "default": "solve"
      },
      "input": {
        "description": "The first argument to pass to the target function. Must be a string or an array of strings to represent a multline string. Can be used with `options` but not with `args`.",
        "type": ["string", "array"],
        "items": { "type": "string" }
      },
      "options": {
        "description": "The second argument to pass to the target function. Typically an object."
      },
      "args": {
        "description": "An entire array of arguments to pass to the target function. Cannot be used with `input` or `options`. Using `input` is more convenient but `args` gives more control when needed.",
        "type": "array"
      },
      "expected": {
        "description": "The expected result returned from the target function. Typically a string or number."
      }
    },
    "required": ["expected"],
    "if": { "required": ["input"] },
    "then": { "not": { "required": ["args"] } },
    "else": { "required": ["args"], "not": { "required": ["options"] } }
  }
}
