[
  {
    "functionName": "lookAndSay",
    "input": "1",
    "options": { "times": 1 },
    "expected": "11"
  },
  {
    "functionName": "lookAndSay",
    "input": "11",
    "options": { "times": 1 },
    "expected": "21"
  },
  {
    "functionName": "lookAndSay",
    "input": "21",
    "options": { "times": 1 },
    "expected": "1211"
  },
  {
    "functionName": "lookAndSay",
    "input": "1211",
    "options": { "times": 1 },
    "expected": "111221"
  },
  {
    "functionName": "lookAndSay",
    "input": "111221",
    "options": { "times": 1 },
    "expected": "312211"
  }
]
